{
  "schema_version": "PromiseScanOutcome.v1",
  "produced_by": "manual:promise-scan-outcome",
  "outcome_id": "outcome-nutriplanner-collapse-seam-20260324T124100Z",
  "task_id": "task-nutriplanner-collapse-seam-scan",
  "frame_id": "frame-nutriplanner-collapse-20260324T101900Z",
  "incident_id": "incident-20260313-235921",
  "promise_id": "promise-nutriplanner-collapse-boundary-lockstep",
  "interaction_family": "row collapse",
  "consistency_boundary": "firstChildToDetailDeltaY remains near lockstep envelope",
  "outcome": "anomaly_found",
  "summary": "Transition probe confirmed a repeatable first-child lag window during collapsed gate ownership handoff, matching the seam drift shape.",
  "witness_ids_added": [],
  "anomaly_ids": [
    "anomaly-boundary-seam-drift"
  ],
  "killed_reason": null,
  "next_action": "Split follow-up work into ownership-handoff ordering vs. reconciliation-timing checks to isolate the first deterministic fix site.",
  "resulting_coverage_status": "anomaly_found",
  "resulting_task_status": "done",
  "created_at": "2026-03-24T12:41:00Z"
}
